<?xml version="1.0" encoding="UTF-8"?>
<note xmlns:xsi="http://www.w3.org/2001/XMLSchema-instance"
xsi:noNamespaceSchemaLocation="schema/note.xsd">
    <to>Tove</to>
    <from>Jani</from>
    <heading>Reminder</heading>
    <body>Don't forget me this weekend</body>
    <job>Teacher</job>
    <language>Spanish</language>
    <brothers>5</brothers>
    <mobile>Xiaomi</mobile>
</note>